{
  "schemaVersion": "caatuu-memory-moon-content-v1",
  "courseId": "ka",
  "gameId": "memory-moon",
  "contentId": "ka.memory-moon.v1",
  "contentRevision": 1,
  "status": "machine-assisted-preview",
  "learnerBaseLanguage": "en",
  "targetLanguage": "ka",
  "englishAuditLanguage": "en",
  "review": {
    "status": "native-review-required",
    "humanApproved": false,
    "reviewer": "OpenAI Codex",
    "reviewedAt": "2026-10-18",
    "notes": "Original Memory Moon authoring with AI self-review. Independent native-language review remains required."
  },
  "license": {
    "origin": "caatuu-first-party-authored",
    "spdxExpression": "AGPL-3.0-only"
  },
  "embeddingPolicy": {
    "inputLanguage": "en",
    "inputField": "embeddingText"
  },
  "challenges": [
    {
      "id": "mm-ka-cold-water",
      "revision": 1,
      "difficulty": 1,
      "usefulness": 98,
      "complexity": 12,
      "topic": "food-and-drink",
      "familyId": "mm-ka-cold-water",
      "targetText": "წყალი ცივია.",
      "learnerBaseText": "The water is cold.",
      "englishText": "The water is cold.",
      "embeddingText": "The water is cold.",
      "focus": {
        "kind": "state",
        "englishConcepts": [
          "The water is cold",
          "food and drink"
        ]
      },
      "correctChoiceId": "correct",
      "choices": [
        {
          "id": "correct",
          "text": "The water is cold.",
          "englishAuditText": "The water is cold."
        },
        {
          "id": "contrast-1",
          "text": "The water is hot.",
          "englishAuditText": "The water is hot.",
          "contrast": {
            "kind": "state",
            "explanation": "The target means “The water is cold.” This option changes the state: “The water is hot.”"
          }
        },
        {
          "id": "contrast-2",
          "text": "The water is warm.",
          "englishAuditText": "The water is warm.",
          "contrast": {
            "kind": "state",
            "explanation": "The target means “The water is cold.” This option changes the state: “The water is warm.”"
          }
        }
      ]
    },
    {
      "id": "mm-ka-fresh-bread",
      "revision": 1,
      "difficulty": 1,
      "usefulness": 95,
      "complexity": 14,
      "topic": "food-and-drink",
      "familyId": "mm-ka-fresh-bread",
      "targetText": "პური ახალია.",
      "learnerBaseText": "The bread is fresh.",
      "englishText": "The bread is fresh.",
      "embeddingText": "The bread is fresh.",
      "focus": {
        "kind": "state",
        "englishConcepts": [
          "The bread is fresh",
          "food and drink"
        ]
      },
      "correctChoiceId": "correct",
      "choices": [
        {
          "id": "correct",
          "text": "The bread is fresh.",
          "englishAuditText": "The bread is fresh."
        },
        {
          "id": "contrast-1",
          "text": "The bread is stale.",
          "englishAuditText": "The bread is stale.",
          "contrast": {
            "kind": "state",
            "explanation": "The target means “The bread is fresh.” This option changes the state: “The bread is stale.”"
          }
        },
        {
          "id": "contrast-2",
          "text": "The bread is frozen.",
          "englishAuditText": "The bread is frozen.",
          "contrast": {
            "kind": "state",
            "explanation": "The target means “The bread is fresh.” This option changes the state: “The bread is frozen.”"
          }
        }
      ]
    },
    {
      "id": "mm-ka-open-door",
      "revision": 1,
      "difficulty": 1,
      "usefulness": 97,
      "complexity": 14,
      "topic": "household",
      "familyId": "mm-ka-open-door",
      "targetText": "კარი ღიაა.",
      "learnerBaseText": "The door is open.",
      "englishText": "The door is open.",
      "embeddingText": "The door is open.",
      "focus": {
        "kind": "state",
        "englishConcepts": [
          "The door is open",
          "household"
        ]
      },
      "correctChoiceId": "correct",
      "choices": [
        {
          "id": "correct",
          "text": "The door is open.",
          "englishAuditText": "The door is open."
        },
        {
          "id": "contrast-1",
          "text": "The door is closed.",
          "englishAuditText": "The door is closed.",
          "contrast": {
            "kind": "state",
            "explanation": "The target means “The door is open.” This option changes the state: “The door is closed.”"
          }
        },
        {
          "id": "contrast-2",
          "text": "The door is locked.",
          "englishAuditText": "The door is locked.",
          "contrast": {
            "kind": "state",
            "explanation": "The target means “The door is open.” This option changes the state: “The door is locked.”"
          }
        }
      ]
    },
    {
      "id": "mm-ka-empty-cup",
      "revision": 1,
      "difficulty": 1,
      "usefulness": 90,
      "complexity": 15,
      "topic": "household",
      "familyId": "mm-ka-empty-cup",
      "targetText": "ჭიქა ცარიელია.",
      "learnerBaseText": "The glass is empty.",
      "englishText": "The glass is empty.",
      "embeddingText": "The glass is empty.",
      "focus": {
        "kind": "state",
        "englishConcepts": [
          "The glass is empty",
          "household"
        ]
      },
      "correctChoiceId": "correct",
      "choices": [
        {
          "id": "correct",
          "text": "The glass is empty.",
          "englishAuditText": "The glass is empty."
        },
        {
          "id": "contrast-1",
          "text": "The glass is full.",
          "englishAuditText": "The glass is full.",
          "contrast": {
            "kind": "state",
            "explanation": "The target means “The glass is empty.” This option changes the state: “The glass is full.”"
          }
        },
        {
          "id": "contrast-2",
          "text": "The glass is broken.",
          "englishAuditText": "The glass is broken.",
          "contrast": {
            "kind": "state",
            "explanation": "The target means “The glass is empty.” This option changes the state: “The glass is broken.”"
          }
        }
      ]
    },
    {
      "id": "mm-ka-small-dog",
      "revision": 1,
      "difficulty": 1,
      "usefulness": 83,
      "complexity": 14,
      "topic": "animals",
      "familyId": "mm-ka-small-dog",
      "targetText": "ძაღლი პატარაა.",
      "learnerBaseText": "The dog is small.",
      "englishText": "The dog is small.",
      "embeddingText": "The dog is small.",
      "focus": {
        "kind": "state",
        "englishConcepts": [
          "The dog is small",
          "animals"
        ]
      },
      "correctChoiceId": "correct",
      "choices": [
        {
          "id": "correct",
          "text": "The dog is small.",
          "englishAuditText": "The dog is small."
        },
        {
          "id": "contrast-1",
          "text": "The dog is large.",
          "englishAuditText": "The dog is large.",
          "contrast": {
            "kind": "state",
            "explanation": "The target means “The dog is small.” This option changes the state: “The dog is large.”"
          }
        },
        {
          "id": "contrast-2",
          "text": "The dog is tall.",
          "englishAuditText": "The dog is tall.",
          "contrast": {
            "kind": "state",
            "explanation": "The target means “The dog is small.” This option changes the state: “The dog is tall.”"
          }
        }
      ]
    },
    {
      "id": "mm-ka-sleeping-cat",
      "revision": 1,
      "difficulty": 1,
      "usefulness": 80,
      "complexity": 18,
      "topic": "animals",
      "familyId": "mm-ka-sleeping-cat",
      "targetText": "კატას სძინავს.",
      "learnerBaseText": "The cat is sleeping.",
      "englishText": "The cat is sleeping.",
      "embeddingText": "The cat is sleeping.",
      "focus": {
        "kind": "action",
        "englishConcepts": [
          "The cat is sleeping",
          "animals"
        ]
      },
      "correctChoiceId": "correct",
      "choices": [
        {
          "id": "correct",
          "text": "The cat is sleeping.",
          "englishAuditText": "The cat is sleeping."
        },
        {
          "id": "contrast-1",
          "text": "The cat is eating.",
          "englishAuditText": "The cat is eating.",
          "contrast": {
            "kind": "action",
            "explanation": "The target means “The cat is sleeping.” This option changes the action: “The cat is eating.”"
          }
        },
        {
          "id": "contrast-2",
          "text": "The cat is playing.",
          "englishAuditText": "The cat is playing.",
          "contrast": {
            "kind": "action",
            "explanation": "The target means “The cat is sleeping.” This option changes the action: “The cat is playing.”"
          }
        }
      ]
    },
    {
      "id": "mm-ka-mother-home",
      "revision": 1,
      "difficulty": 1,
      "usefulness": 95,
      "complexity": 15,
      "topic": "family",
      "familyId": "mm-ka-mother-home",
      "targetText": "დედა სახლშია.",
      "learnerBaseText": "Mother is at home.",
      "englishText": "Mother is at home.",
      "embeddingText": "Mother is at home.",
      "focus": {
        "kind": "location",
        "englishConcepts": [
          "Mother is at home",
          "family"
        ]
      },
      "correctChoiceId": "correct",
      "choices": [
        {
          "id": "correct",
          "text": "Mother is at home.",
          "englishAuditText": "Mother is at home."
        },
        {
          "id": "contrast-1",
          "text": "Mother is at work.",
          "englishAuditText": "Mother is at work.",
          "contrast": {
            "kind": "location",